{
  "id": "knapsack",
  "name": "Knapsack.cloud",
  "summary": "Knapsack runs TWO distinct MCP servers and is explicit about the difference. (1) The Knapsack MCP: a per-workspace endpoint at https://mcp.knapsack.cloud/mcp/<workspace-id> exposing your own workspace’s tokens, components, patterns and docs to any MCP client; setup is via the mcp-remote npx shim (requires Node 20+) and browser OAuth; gated behind an “Early Access” workspace flag. (2) A docs-site MCP at https://docs.knapsack.cloud/_mcp/server serving Knapsack’s own product documentation, with one-click “Connect to Claude Code” / “Connect to Cursor” page-action buttons. Knapsack’s docs site (built on Fern) also ships a full llms.txt with an explicit “Instructions for AI Agents” preamble, section-scoped llms.txt (append /llms.txt to any section URL), and per-page Markdown via appending .md: a three-tier retrieval design (llms.txt for whole-site, .md for single page, MCP for interactive). The differentiating builder feature is Data Sources: a contextual data layer wiring Storybook (live component implementation), the Knapsack workspace (tokens/docs/patterns) and Markdown files into MCP, pitched as letting AI “surface inconsistencies, flag drift”. PRICING/AVAILABILITY: Knapsack MCP requires an Early Access flag on the workspace or connection fails; Data Sources is explicitly gated: “Contact your sales partner to discuss unlocking data sources.” Knapsack is enterprise/sales-led with no self-serve public pricing; it raised a $10M Series A (Oct 2025) and positions the “Intelligent Product Engine” with limited beta and GA targeted March 2026. GAPS: no published list of Knapsack MCP tool names (unlike zeroheight and Supernova); no Code Connect-style mapping file; no public AGENTS.md/CLAUDE.md conventions; no customer-named adoption.",
  "capabilities": [
    {
      "title": "Knapsack MCP — per-workspace endpoint, bring-your-own-model",
      "description": "A secure MCP server endpoint per workspace at https://mcp.knapsack.cloud/mcp/<workspace-id>, giving MCP-compatible clients read access to workspace design system content and metadata (tokens, components, docs). Knapsack explicitly frames this as “bring-your-own-model”, with no lock-in to a single LLM provider. Workspace ID is the path segment between /site/ and /latest in your Knapsack site URL. Note the docs also flag it for enterprise MCP allowlists/registries.",
      "audience": "consumers",
      "url": "https://docs.knapsack.cloud/intelligent-tools",
      "snippet": {
        "language": "markdown",
        "content": "**Knapsack MCP exposes a secure MCP server endpoint per workspace.** The endpoint conforms to the Model Context Protocol specification, enabling compliant clients (such as Claude Desktop) to register a Knapsack workspace as a source. Each MCP server instance is identified by a workspace-specific endpoint, typically:\n\n`https://mcp.knapsack.cloud/mcp/<workspace-id>`\n\nThe client authenticates and maintains a session via this endpoint to retrieve context-aware resources.",
        "source_url": "https://docs.knapsack.cloud/intelligent-tools.md"
      }
    },
    {
      "title": "Claude Desktop config via mcp-remote (Node 20+ required)",
      "description": "Official setup snippet. Knapsack MCP is a remote HTTP server proxied through the mcp-remote npx shim; auth happens in the browser on first connect. Docs call out Node 20 as a hard prerequisite and list “Early Access not enabled” as the top connection-failure cause.",
      "audience": "consumers",
      "url": "https://docs.knapsack.cloud/intelligent-tools/configure-with-claude",
      "snippet": {
        "language": "json",
        "content": "{\n  \"mcpServers\": {\n    \"knapsack-mcp-toby\": {\n      \"command\": \"npx\",\n      \"args\": [\n        \"-y\",\n        \"mcp-remote\",\n        \"https://mcp.knapsack.cloud/mcp/toby\"\n      ]\n    }\n  }\n}",
        "source_url": "https://docs.knapsack.cloud/intelligent-tools/configure-with-claude.md"
      }
    },
    {
      "title": "Data Sources — Storybook + workspace + Markdown as a grounded context layer",
      "description": "Sales-gated feature that turns MCP from a docs lookup into a grounded, multi-source context layer. Three source types at launch: Storybook (live component implementation), the Knapsack workspace (tokens, documentation, patterns), and Markdown files (any additional guidelines). Framed as enabling drift detection: “AI that can surface inconsistencies, flag drift, and generate outputs that stay true to your design standards at every layer.” The Storybook source is the closest thing Knapsack has to forcing the agent onto real component source rather than trained-in approximations.",
      "audience": "both",
      "url": "https://docs.knapsack.cloud/intelligent-tools",
      "snippet": {
        "language": "markdown",
        "content": "#### Unlock the power of Data Sources\n\nFor teams who want more, Intelligent Tools allows you to create a contextual data layer to empower MCP workflows. In this release, you can connect three source types: **Storybook**, for live component implementation; your **Knapsack workspace**, for tokens, documentation, and patterns; and **Markdown files**, for any additional guidelines or reference content. Together, these give your AI a complete, grounded view of your design system.\n\nContact your sales partner to discuss unlocking data sources.\n\n### Data Sources Available\n\nData Sources takes your MCP connection further. By linking external content — like your product codebase, brand guidelines, or Figma libraries — you give Knapsack a richer view of how your design system is actually built and used. The result: AI that can surface inconsistencies, flag drift, and generate outputs that stay true to your design standards at every layer.",
        "source_url": "https://docs.knapsack.cloud/intelligent-tools.md"
      }
    },
    {
      "title": "Docs-site llms.txt with an explicit “Instructions for AI Agents” preamble",
      "description": "Knapsack’s product docs publish an llms.txt that opens by telling agents exactly how to retrieve content in three modalities: .md suffix per page, section-scoped /llms.txt, and the docs MCP server. Every .md page also repeats the same three-line preamble at the top, so any agent that fetches a single page is immediately told about the other two retrieval paths. This is a clean, copyable pattern for a DS docs site.",
      "audience": "consumers",
      "url": "https://docs.knapsack.cloud/llms.txt",
      "snippet": {
        "language": "markdown",
        "content": "# Knapsack Documentation\n\n> Documentation for Knapsack, the design system platform that unifies design tokens, components, and docs so teams design, build, and ship consistent products.\n\n## Instructions for AI Agents\n\n- For clean Markdown of any page, append `.md` to the page URL\n- For section-specific indexes, append `/llms.txt` to any section URL\n- For AI client integration (Claude Code, Cursor, etc.), connect to the MCP server at https://docs.knapsack.cloud/_mcp/server",
        "source_url": "https://docs.knapsack.cloud/llms.txt"
      }
    },
    {
      "title": "Docs MCP server + one-click client install (separate from workspace MCP)",
      "description": "A second, distinct MCP server that exposes Knapsack’s own documentation so agents stop “guessing from stale training data”. Page-action buttons at the top of every docs page copy a `claude mcp add` command or deep-link into Cursor with the URL pre-filled. Knapsack explicitly disambiguates it from the workspace MCP.",
      "audience": "both",
      "url": "https://docs.knapsack.cloud/intelligent-tools/mcp-server",
      "snippet": {
        "language": "markdown",
        "content": "This documentation site runs its own Model Context Protocol (MCP) server, so an AI coding assistant can query these docs directly instead of guessing from stale training data. Ask it how to configure SSO, wire up a Git provider, or troubleshoot a deploy preview, and it can pull the answer straight from these pages.\n\nThe server is available at:\n\n`https://docs.knapsack.cloud/_mcp/server`\n\nThis MCP server exposes the content of *this documentation site*. It's a different thing from the [Knapsack MCP](/intelligent-tools), which connects AI tools to your own workspace's design tokens, components, and docs.\n\n[...]\n\nFor a CLI client like Claude Code:\n\n```bash title=\"Terminal\"\nclaude mcp add --transport http knapsack-docs https://docs.knapsack.cloud/_mcp/server\n```",
        "source_url": "https://docs.knapsack.cloud/intelligent-tools/mcp-server.md"
      }
    },
    {
      "title": "Three-tier retrieval guidance: llms.txt vs .md vs MCP",
      "description": "Knapsack documents when to use each retrieval channel, a rare piece of explicit guidance on machine-readable docs architecture. Also documents provenance: the one-line description in llms.txt comes from each page’s frontmatter `description`, falling back to `subtitle`. Useful precedent for DS teams generating their own llms.txt.",
      "audience": "builders",
      "url": "https://docs.knapsack.cloud/intelligent-tools/llms-txt",
      "snippet": {
        "language": "markdown",
        "content": "## When to use which\n\n* Pointing an agent at the whole site, or one section of it: `llms.txt`.\n* Pointing it at a single page, or copying a page for your own agent: the `.md` URL or the page-action buttons.\n* Interactive, conversational access from an AI coding tool: the [MCP server](/intelligent-tools/mcp-server).",
        "source_url": "https://docs.knapsack.cloud/intelligent-tools/llms-txt.md"
      }
    },
    {
      "title": "Framing: AI output vs actual standards",
      "description": "Knapsack’s stated thesis for Intelligent Tools, useful as a quotable position statement on why MCP beats prompt-pasting.",
      "audience": "both",